headline,date,source
"The Las Vegas Raiders hired Tampa Bay Buccaneers assistant general manager John Spytek to be their GM, a person with knowledge of the situation tells The Associated Press.",2025-01-22T11:33:11.474432,ap
"Hawaii fireworks blast victims have injuries comparable to those seen on a battlefield, doctor says",2025-01-22T11:33:11.474432,abc
Jan. 6 rioters speak out against pardons,2025-01-22T11:33:11.474432,abc
"2 Dead, Including Gunman, in Nashville High School Shooting, Police Say",2025-01-22T12:04:47.763751,nytimes
Supreme Court likely to side with family of man killed by police after his rental car was pulled over for toll violations,2025-01-22T12:04:47.763751,cnn
‘A slap in the face to the Capitol police’: Convicted woman doesn’t want Trump’s Jan. 6 pardon ,2025-01-22T12:04:47.763751,cnn
"Teen fatally shoots a female student and himself at Antioch High School in Nashville, police say",2025-01-22T12:04:47.763751,ap
Trump’s threat of tariffs and sanctions on Russia over Ukraine may fall flat,2025-01-22T12:04:47.763751,ap
Seth Rogen’s ‘The Studio’ to open SXSW,2025-01-22T12:04:47.763751,ap
A family of 4 die in fire at an apartment in the Kansas City suburb of Independence,2025-01-22T12:04:47.763751,ap
Stellantis to resume work at Illinois plant in 2027 as it looks to resolve issues with UAW,2025-01-22T12:04:47.763751,ap
"Automaker Stellantis plans to reopen an assembly plant in Illinois and build the next generation Dodge Durango in Detroit, the automaker said Wednesday.",2025-01-22T12:04:47.763751,ap
Starbucks' policy change flushes out a debate over public restroom access,2025-01-22T12:04:47.763751,abc
LA fire costs could reach $30 billion for insurers,2025-01-22T12:04:47.763751,abc
FDA floats plan to make cigarettes nonaddictive,2025-01-22T12:04:47.763751,abc
An Ancient Headless Statue Is Found Amid Trash in Greece,2025-01-22T12:36:26.075647,nytimes
South Carolina Utility Seeks Buyers for Failed Nuclear Project,2025-01-22T12:36:26.075647,nytimes
"Divvy Homes, Once Valued at $2 Billion, Is Sold for Half That Price",2025-01-22T12:36:26.075647,nytimes
Residents under mandatory evacuation in northern Los Angeles County in first significant wildfire outbreak since fatal fires ,2025-01-22T12:36:26.075647,cnn
"Student fatally shoots 1 student, wounds another at Nashville high school, police say",2025-01-22T12:36:26.075647,cnn
Federal agents investigating after Border Patrol agent fatally shot in Vermont ,2025-01-22T12:36:26.075647,cnn
"5 things to know for Jan. 21: Executive actions, Gender identity, Winter storm, Ski resort fire, Costco strike ",2025-01-22T12:36:26.075647,cnn
"Trump’s three-day immigration blitz severely tightens border, sets stage for rapid deportations ",2025-01-22T12:36:26.075647,cnn
US military ordering thousands more troops to southern border,2025-01-22T12:36:26.075647,cnn
Danish official fires back at Trump for eyeing Greenland ,2025-01-22T12:36:26.075647,cnn
"New York Jets are hiring Detroit Lions defensive coordinator Aaron Glenn as head coach, per reports ",2025-01-22T12:36:26.075647,cnn
4 Chilean men indicted in high-profile burglary probe – possibly tied to break-in at Bengals QB Joe Burrow’s home,2025-01-22T12:36:26.075647,cnn
Stock market today: Netflix and AI excitement send Wall Street toward an all-time high,2025-01-22T12:36:26.075647,ap
Everything Trump did in the first executive orders and actions of his presidency,2025-01-22T12:36:26.075647,ap
A federal judge says President Donald Trump’s mass pardons for rioters who stormed the U.S. Capitol won’t change the truth of what happened in the nation’s capital four years ago.,2025-01-22T12:36:26.075647,ap
Evacuations ordered as new fast-moving wildfire threatens mountain homes north of Los Angeles,2025-01-22T12:36:26.075647,ap
"Sledding on boogie boards, ice hockey on Canal Street: The Gulf Coast embraces a rare snow day",2025-01-22T12:36:26.075647,ap
New Michigan law requires destruction of guns turned in during community buybacks,2025-01-22T12:36:26.075647,ap
Native Hawaiian brothers say police framed them for a tourist’s murder in 1991,2025-01-22T12:36:26.075647,ap
"Nancy Leftenant-Colon, who was the first Black woman in Army Nurse Corps, has died",2025-01-22T12:36:26.075647,ap
Texas man who tried to scam ex-US Rep. George Santos sentenced to 18 months in prison,2025-01-22T12:36:26.075647,ap
160 national security staffers are sent home as the White House aligns its team to Trump’s agenda,2025-01-22T12:36:26.075647,ap
Musk clashes with OpenAI CEO Sam Altman over Trump-supported Stargate AI data center project,2025-01-22T12:36:26.075647,ap
Environmentalists say Trump’s energy order would subvert the Endangered Species Act,2025-01-22T12:36:26.075647,ap
Trump administration freezes many health agency reports and online posts,2025-01-22T12:36:26.075647,ap
"On ""Farmtok,"" agriculture gets its moment in the spotlight. What would it mean if that disappeared?",2025-01-22T12:36:26.075647,abc
Get ready for an even bigger chill. Siberian air to make Trump swearing-in coldest in 40 years,2025-01-22T12:36:26.075647,abc
Rain headed to LA will bring threat of landslides,2025-01-22T12:36:26.075647,abc
New York man arrested for injecting fake Botox,2025-01-22T12:36:26.075647,abc
What Are Sanctuary Cities?,2025-01-22T13:08:02.203796,nytimes
Kennedy Would Keep Stake in H.P.V. Vaccine Suit if Confirmed,2025-01-22T13:08:02.203796,nytimes
Senate Democrats Block G.O.P. Effort to Criminalize Some Abortion Providers,2025-01-22T13:08:02.203796,nytimes
Reddit Users Boycott X Links After Elon Musk’s Gesture at Inaugural Event,2025-01-22T13:08:02.203796,nytimes
Here’s what we know about the Nashville high school shooting ,2025-01-22T13:08:02.203796,cnn
How TikTok became a ‘poker chip’ in a high-stakes game between Trump and China ,2025-01-22T13:08:02.203796,cnn
How TikTok became a ‘poker chip’ in a high-stakes game between Trump and China,2025-01-22T13:08:02.203796,cnn
Trump says he can cut the cost of buying a home. Here’s the reality behind that,2025-01-22T13:08:02.203796,cnn
China’s economy grows more than expected. But fears of Trump tariffs loom ,2025-01-22T13:08:02.203796,cnn
"As US TikTok users move to RedNote, some are encountering Chinese-style censorship for the first time",2025-01-22T13:08:02.203796,cnn
Many crypto investors’ transactions this year will be reported to the IRS for first time ,2025-01-22T13:08:02.203796,cnn
Outgoing FCC chair rejects high-profile TV petitions as attempt to ‘weaponize’ government,2025-01-22T13:08:02.203796,cnn
Stock market today: Netflix and AI excitement send Wall Street near an all-time high,2025-01-22T13:08:02.203796,ap
Middle East latest: Israel says it killed a militant in Gaza as fragile ceasefire holds,2025-01-22T13:08:02.203796,ap
"Trump’s Jan. 6 pardons won’t change the ‘truth,’ judges say",2025-01-22T13:08:02.203796,ap
Two federal judges say President Donald Trump’s mass pardons for rioters who stormed the U.S. Capitol won’t change the truth about what happened in the nation’s capital four years ago.,2025-01-22T13:08:02.203796,ap
Steve Bannon’s border wall trial delayed until March 4 as new lawyers plot aggressive defense,2025-01-22T13:08:02.203796,ap
Trump has canceled Biden’s ethics rules. Critics call it the opposite of ‘drain the swamp’,2025-01-22T13:08:02.203796,ap
White House would have many ways to upend lives of Trump’s enemies,2025-01-22T13:08:02.203796,ap
Brothers say police framed them for 1991 murder,2025-01-22T13:08:02.203796,abc
Democrats Slow G.O.P. Rush to Confirm Trump Nominees,2025-01-22T13:39:38.122207,nytimes
Thursday Briefing: Trump’s Immigration Crackdown,2025-01-22T13:39:38.122207,nytimes
Mandatory evacuations ordered in northern LA County in first significant wildfire outbreak since fatal fires ,2025-01-22T13:39:38.122207,cnn
Visualizing the Los Angeles wildfires in maps and charts,2025-01-22T13:39:38.122207,cnn
Strong winds remain a threat to Southern California as firefighters bat down new wildfires ,2025-01-22T13:39:38.122207,cnn
How cities across the US are preparing for Trump’s immigration crackdown ,2025-01-22T13:39:38.122207,cnn
Democrats grapple with their own message in Trump 2.0,2025-01-22T13:39:38.122207,cnn
"Trump’s three-day immigration blitz severely tightens border, sets stage for rapid deportations",2025-01-22T13:39:38.122207,cnn
Why some Instagram users aren’t able to unfollow Trump and JD Vance ,2025-01-22T13:39:38.122207,cnn
Why some Instagram users aren’t able to unfollow Trump and JD Vance,2025-01-22T13:39:38.122207,cnn
Big Oil celebrates the return of Trump. Clean energy braces for trouble ,2025-01-22T13:39:38.122207,cnn
China’s economy grows more than expected. But fears of Trump tariffs loom,2025-01-22T13:39:38.122207,cnn
"UnitedHealth Group CEO: US health care needs to be ‘less confusing, less complex and less costly’ ",2025-01-22T13:39:38.122207,cnn
TikTok had an incredibly wild whirlwind of a weekend ,2025-01-22T13:39:38.122207,cnn
Former DC police officer fires back at Oath Keeper after he was released from prison ,2025-01-22T13:39:38.122207,cnn
Stock market today: Netflix and AI excitement send Wall Street to the brink of an all-time high,2025-01-22T13:39:38.122207,ap
Colombian president visits southern Haiti as country battles surge in gang violence,2025-01-22T13:39:38.122207,ap
What makes a landslide and why they are familiar in Indonesia,2025-01-22T13:39:38.122207,ap
South Sudan orders temporary ban on social media over violence in neighboring Sudan,2025-01-22T13:39:38.122207,ap
"Pentagon will send up to 1,500 active duty troops to help secure US-Mexico border",2025-01-22T13:39:38.122207,ap
House prepares to pass immigrant detention bill that would be Trump’s first law to sign,2025-01-22T13:39:38.122207,ap
"How major US stock indexes fared Wednesday, 1/22/2025",2025-01-22T13:39:38.122207,ap
"Netflix, Oracle and other technology stocks lifted U.S. indexes as their profits pile higher and excitement builds around the moneymaking prospects of artificial intelligence.",2025-01-22T13:39:38.122207,ap
"South Sudanese authorities have ordered telecoms to block access to social media for at least 30 days, citing concerns over the dissemination of graphic content relating to the ongoing violence against South Sudanese in neighboring Sudan.",2025-01-22T13:39:38.122207,ap
FDA bans red dye No. 3 from foods,2025-01-22T13:39:38.122207,abc
"US accuses Walgreens of filling millions of illegitimate prescriptions, including for opioids",2025-01-22T13:39:38.122207,abc
Student shot dead at Nashville high school,2025-01-22T13:39:38.122207,abc
Judges in Washington Push Back on Trump’s Reprieve of Jan. 6 Defendants,2025-01-22T14:11:14.351207,nytimes
Mandatory evacuations ordered in northern LA County in first significant wildfire outbreak since fatal fires,2025-01-22T14:11:14.351207,cnn
Congress passes immigrant detention bill in first legislative win for Trump ,2025-01-22T14:11:14.351207,cnn
Restaurant offers Mark Andrews free food for life after dropping game tying playoff pass ,2025-01-22T14:11:14.351207,cnn
Students create bodycam device for police,2025-01-22T14:11:14.351207,cnn
PD: Man shoots Wendy’s worker over cold fries,2025-01-22T14:11:14.351207,cnn
Anne Frank exhibit recreates rooms family hid in,2025-01-22T14:11:14.351207,cnn
"PD: Mother found entombed, boyfriend charged",2025-01-22T14:11:14.351207,cnn
Sheetz partners with Fortnite to create contest,2025-01-22T14:11:14.351207,cnn
"Dog found in dumpster, spent hours in cold",2025-01-22T14:11:14.351207,cnn
Father & son discover human skull during walk,2025-01-22T14:11:14.351207,cnn
High school basketball player who helped save opponent’s life honored ,2025-01-22T14:11:14.351207,cnn
Rancher jumps into frozen pond to save calf,2025-01-22T14:11:14.351207,cnn
Man charged with setting fire over TikTok ban,2025-01-22T14:11:14.351207,cnn
Students work to invent new type of concrete,2025-01-22T14:11:14.351207,cnn
Tow truck driver saves couple from car crash,2025-01-22T14:11:14.351207,cnn
"Residents wake up to below-zero temps, no heat",2025-01-22T14:11:14.351207,cnn
Woman celebrates snowstorms 62 years apart,2025-01-22T14:11:14.351207,cnn
Teen guilty of using Snapchat in school threat,2025-01-22T14:11:14.351207,cnn
Boulder County K-9’s retirement party was everything a dog could want ,2025-01-22T14:11:14.351207,cnn
Dry cleaners offer services to wildfire victims,2025-01-22T14:11:14.351207,cnn
Another woman falls victim to ‘grandson scam’,2025-01-22T14:11:14.351207,cnn
Sensory rooms help travelers fight flying jitters,2025-01-22T14:11:14.351207,cnn
PD: Family arrested for string of card skimming,2025-01-22T14:11:14.351207,cnn
Quilting group aiding CA wildfire victims,2025-01-22T14:11:14.351207,cnn
Stolen baby and truck recovered after theft,2025-01-22T14:11:14.351207,cnn
Gym goers subdue suspect after attack in gym,2025-01-22T14:11:14.351207,cnn
"More than 32,000 displaced as violence spirals in Colombian drug trafficking region ",2025-01-22T14:11:14.351207,cnn
Yemen’s Houthis free crew of Red Sea cargo ship after 14 months in captivity,2025-01-22T14:11:14.351207,cnn
Bollywood actor Saif Ali Khan returns home from hospital days after knife attack,2025-01-22T14:11:14.351207,cnn
"Drone captures new border barriers, days after Trump inauguration ",2025-01-22T14:11:14.351207,cnn
"Two killed in knife attack in German park, suspect arrested ",2025-01-22T14:11:14.351207,cnn
"Putin’s ‘not doing so well,’ says Trump in unusually critical remarks on Kremlin leader",2025-01-22T14:11:14.351207,cnn
Hot sleeper? The Sleep Number ClimateCool smart bed has science-backed cooling features for each partner ,2025-01-22T14:11:14.351207,cnn
An abortion clinic moved to a ‘safe haven’ state. It didn’t get a warm welcome,2025-01-22T14:11:14.351207,cnn
This disease is known as the ‘silent killer.’ A doctor explains why ,2025-01-22T14:11:14.351207,cnn
STAT Plus: RFK Jr. to face key Senate committee hearing before end of the month,2025-01-22T14:11:14.351207,stat
Oath Keepers founder Stewart Rhodes visits Capitol Hill after Trump clemency,2025-01-22T14:11:14.351207,ap
"Oath Keepers founder Stewart Rhodes, the far-right extremist group leader convicted of seditious conspiracy in the Jan. 6, 2021, attack, has visited Capitol Hill after President Donald Trump commuted his 18-year prison sentence.",2025-01-22T14:11:14.351207,ap
"With EPA support, the Corps is moving forward with flood relief project for Mississippi Delta",2025-01-22T14:11:14.351207,ap
"Meagan Good says goodbye to ‘Harlem,’ hello to her future with Jonathan Majors",2025-01-22T14:11:14.351207,ap
House passes immigrant detention bill that would be Trump’s first law to sign,2025-01-22T14:11:14.351207,ap
Trump’s orders to end DEI programs reflect his push for a profound cultural shift,2025-01-22T14:11:14.351207,ap
The head of a federal agency for consumers has packed up his office. But will Trump fire him?,2025-01-22T14:11:14.351207,ap
Trump meets with more Republicans as they hash out legislative roadmap,2025-01-22T14:11:14.351207,ap
"Amazon to close 7 warehouses in the Canadian province of Quebec and eliminate 1,700 jobs",2025-01-22T14:11:14.351207,ap
"Charles Phan, chef who elevated Vietnamese cuisine with San Francisco’s Slanted Door, dies at 62",2025-01-22T14:11:14.351207,ap
"Charles Phan, the San Francisco chef credited as an innovator for bringing Vietnamese food to fine dining at his Slanted Door restaurant, has died at age 62.",2025-01-22T14:11:14.351207,ap
"Amazon to close 7 warehouses in Canada and eliminate 1,700 jobs",2025-01-22T14:11:14.351207,abc
Steve Bannon pushes for more 'aggressive' defense,2025-01-22T14:11:14.351207,abc
"Residents Return to See What the Fire Left Behind, and to Say Goodbye",2025-01-23T06:16:28.438525,nytimes
"Hughes Fire Burns 10,000 Acres as Dangerous Conditions Persist in Southern California",2025-01-23T06:16:28.438525,nytimes
Does D.E.I. Help or Hurt Jewish Students?,2025-01-23T06:16:28.438525,nytimes
The Bishop Who Pleaded With Trump: ‘Was Anyone Going to Say Anything?’,2025-01-23T06:16:28.438525,nytimes
Trump’s Agriculture Pick to Face Questioning from Lawmakers,2025-01-23T06:16:28.438525,nytimes
Read: Draft Options for G.O.P. Cost Cuts for Tax Bill,2025-01-23T06:16:28.438525,nytimes
"After Snow and Frigid Temperatures, Southern U.S. Now Faces Icy Roads",2025-01-23T06:16:28.438525,nytimes
House G.O.P. Floats Medicaid Cuts and More to Finance Trump’s Huge Agenda,2025-01-23T06:16:28.438525,nytimes
Revenge of the Ski Bums,2025-01-23T06:16:28.438525,nytimes
L.A. Crews Battle New Brush Fire Near Bel-Air,2025-01-23T06:16:28.438525,nytimes
Saudi Arabia Says It Will Increase U.S. Trade and Investment by $600 Billion,2025-01-23T06:16:28.438525,nytimes
Trump Pardons 2 D.C. Officers Convicted in Fatal Chase and Cover-Up,2025-01-23T06:16:28.438525,nytimes
Hamas Takes Charge in Gaza After 15 Months of War,2025-01-23T06:16:28.438525,nytimes
Thailand Celebrates New Same-Sex Marriage Law With Mass Wedding,2025-01-23T06:16:28.438525,nytimes
Inside the Plan to Receive Thousands of Mexicans Deported From the U.S.,2025-01-23T06:16:28.438525,nytimes
"With Support Dwindling and Trump in Power, Zelensky Could Face Tough Re-election",2025-01-23T06:16:28.438525,nytimes
Passengers Fled a Train Over Fears of a Fire. Then Another Train Hit Them.,2025-01-23T06:16:28.438525,nytimes
Israeli Forces Kill 2 Men in Jenin Who They Say Were Wanted for Murder,2025-01-23T06:16:28.438525,nytimes
Wembanyama Prepares to Become ‘Genuine’ Face of the N.B.A.,2025-01-23T06:16:28.438525,nytimes
Map: 5.7-Magnitude Earthquake Strikes the Philippines,2025-01-23T06:16:28.438525,nytimes
Migrants Left Stranded After Trump Cancels Asylum Claims at Border,2025-01-23T06:16:28.438525,nytimes
Trump Administration Cancels Flights for Refugees Already Approved for Travel,2025-01-23T06:16:28.438525,nytimes
"Why Is Israel Targeting Jenin, in the West Bank?",2025-01-23T06:16:28.438525,nytimes
How Europe Is Preparing for a New Era of Trump,2025-01-23T06:16:28.438525,nytimes
A Start-Up Claimed Its Device Could Cure Cancer. Then Patients Began Dying.,2025-01-23T06:16:28.438525,nytimes
"When A.I. Passes This Test, Look Out",2025-01-23T06:16:28.438525,nytimes
Trump’s D.E.I. Order Creates ‘Fear and Confusion’ Among Corporate Leaders,2025-01-23T06:16:28.438525,nytimes
The War on D.E.I. Heats Up,2025-01-23T06:16:28.438525,nytimes
2025 Oscar Nominations: ‘Emilia Pérez’ and ‘The Brutalist’ Get Multiple Nods,2025-01-23T06:16:28.438525,nytimes
ChatGPT Outage Reported by Thousands of Users,2025-01-23T06:16:28.438525,nytimes
CNN Plots Major Overhaul as It Enters a New Trump Era,2025-01-23T06:16:28.438525,nytimes
Bitter Boardroom Feud for Korea Zinc Takes a Dramatic Turn,2025-01-23T06:16:28.438525,nytimes
Will Dress Shirts Return to the Office?,2025-01-23T06:16:28.438525,nytimes
Help! British Airways Destroyed Our Guitar and Won’t Pay Up.,2025-01-23T06:16:28.438525,nytimes
Trump Sees National Emergencies Where Experts Say There Are None,2025-01-23T06:16:28.438525,nytimes
"31,000 people must evacuate as new infernos torch fire-ravaged Southern California ",2025-01-23T06:16:28.438525,cnn
Columbia University ‘expediting’ investigation into Israeli history class disruption,2025-01-23T06:16:28.438525,cnn
"Authorities investigate purported writings from teen accused of opening fire at a Nashville high school, killing a student",2025-01-23T06:16:28.438525,cnn
New fire erupts in Southern California as thousands remain under evacuation from fast-moving Hughes Fire,2025-01-23T06:16:28.438525,cnn
"5 things to know for Jan. 23: Immigration, School shooting, California wildfires, winter storm, Thailand marriage equality",2025-01-23T06:16:28.438525,cnn
"7 San Antonio police officers were shot while responding to a call, police say",2025-01-23T06:16:28.438525,cnn
"In western Altadena, where 17 wildfire deaths were reported, residents say evacuation alerts came late or not at all",2025-01-23T06:16:28.438525,cnn
School shootings in the US: Fast facts ,2025-01-23T06:16:28.438525,cnn
"Who foots the bill for LA wildfires, ‘silent killer,’ the face of rugby: Catch up on the day’s stories",2025-01-23T06:16:28.438525,cnn
‘She was my girl’: Aunt tearfully describes student killed in school shooting ,2025-01-23T06:16:28.438525,cnn
Yet another blaze breaks out in LA as thousands evacuate new fires ,2025-01-23T06:16:28.438525,cnn
Video shows aerial view of fast-moving Hughes Fire in Castaic ,2025-01-23T06:16:28.438525,cnn
Trump’s Justice Department halts police reform agreements ,2025-01-23T06:16:28.438525,cnn
Trump is imposing MAGA rule on the government hour-by-hour,2025-01-23T06:16:28.438525,cnn
"They sentenced the January 6 rioters. Now, these judges are calling out Trump and ‘poor losers’",2025-01-23T06:16:28.438525,cnn
‘The gloves are off’: Trump appears poised to cash in from his presidency in new ways,2025-01-23T06:16:28.438525,cnn
"Today’s CEOs are the last to manage all-human workforces, says Marc Benioff ",2025-01-23T06:16:28.438525,cnn
"No, Trump did not become an overnight ‘crypto billionaire’",2025-01-23T06:16:28.438525,cnn
What replaces a community that has been burned down? Further gentrification,2025-01-23T06:16:28.438525,cnn
"Tech giants ramp up the battle against online hate speech in Europe. At home, some are pulling back",2025-01-23T06:16:28.438525,cnn
David Culver meets legal migrants who keep America’s farms running ,2025-01-23T06:16:28.438525,cnn
Veronica Miracle shows where a new fire has broken out near Los Angeles ,2025-01-23T06:16:28.438525,cnn
Gunshots ring out in cafeteria during deadly Nashville school shooting ,2025-01-23T06:16:28.438525,cnn
Deputies deploy to help firefighters with a new CA wildfire ,2025-01-23T06:16:28.438525,cnn
LA County Fire Chief on new fire exploding in size ,2025-01-23T06:16:28.438525,cnn
Mass. AG responds to Trump’s new immigration crackdown ,2025-01-23T06:16:28.438525,cnn
LA fire chief updates CNN on details about new fire ,2025-01-23T06:16:28.438525,cnn
Former Georgia prosecutor faces trial for allegedly obstructing Ahmaud Arbery killing investigation. Here’s what we know ,2025-01-23T06:16:28.438525,cnn
International Criminal Court seeks warrants for Taliban leaders for gender-based crimes ,2025-01-23T06:16:28.438525,cnn
French woman blamed for divorce because she no longer had sex with husband wins appeal at top European court,2025-01-23T06:16:28.438525,cnn
South Sudan suspends social media platforms over videos of Sudan killings,2025-01-23T06:16:28.438525,cnn
"Russian spy vessel enters UK waters for second time, British Navy says",2025-01-23T06:16:28.438525,cnn
Hundreds of same-sex couples wed as Thailand’s landmark marriage bill takes effect,2025-01-23T06:16:28.438525,cnn
Elon Musk is causing trouble in Europe. What’s in it for him?,2025-01-23T06:16:28.438525,cnn
Stranded at the border: Migrants are in limbo after Trump cancels border app appointments,2025-01-23T06:16:28.438525,cnn
"West Bank mayor warns of ‘man-made disaster,’ as Israel says it took ‘lessons’ from Gaza war",2025-01-23T06:16:28.438525,cnn
"Canada will ‘respond robustly’ if Trump imposes ‘unfair tariffs,’ says PM Trudeau ",2025-01-23T06:16:28.438525,cnn
Rail accident kills 12 in western India after passengers jump onto tracks over fire alert,2025-01-23T06:16:28.438525,cnn
‘Americans kickstarted the resurrection’: Now Italians are snapping up $1 homes for themselves ,2025-01-23T06:16:28.438525,cnn
"Nepal increases Mount Everest climbing fee to $15,000",2025-01-23T06:16:28.438525,cnn
Exploring the city where modern America was born,2025-01-23T06:16:28.438525,cnn
Now you can have Martha Stewart in your garden ,2025-01-23T06:16:28.438525,cnn
How African designers are making their mark on global fashion,2025-01-23T06:16:28.438525,cnn
"Double denim, shearling and a little romance: What men’s fashion will look like in 2025",2025-01-23T06:16:28.438525,cnn
Icy roads pose dangerous threat in wake of massive winter storm that paralyzed Gulf Coast with record-breaking snow ,2025-01-23T06:16:28.438525,cnn
"Coral bleaching on Australia’s Great Barrier Reef reaches ‘catastrophic’ levels, study finds ",2025-01-23T06:16:28.438525,cnn
China’s navy commissions new-generation frigate as competition rises with US and others ,2025-01-23T06:16:28.438525,cnn
"Meet Roki Sasaki, the Los Angeles Dodgers’ next Japanese superstar ",2025-01-23T06:16:28.438525,cnn
Aryna Sabalenka reaches third straight Australian Open final with victory over Paula Badosa,2025-01-23T06:16:28.438525,cnn
Is this English soccer club the next Wrexham story?,2025-01-23T06:16:28.438525,cnn
Manchester City on brink of Champions League elimination after spectacular collapse against PSG,2025-01-23T06:16:28.438525,cnn
Miami Heat suspend star forward Jimmy Butler for second time in three weeks,2025-01-23T06:16:28.438525,cnn
"Today’s CEOs are the last to manage all-human workforces, says Marc Benioff",2025-01-23T06:16:28.438525,cnn
"No, Trump did not become an overnight ‘crypto billionaire’ ",2025-01-23T06:16:28.438525,cnn
What replaces a community that has been burned down? Further gentrification ,2025-01-23T06:16:28.438525,cnn
"Tech giants ramp up the battle against online hate speech in Europe. At home, some are pulling back ",2025-01-23T06:16:28.438525,cnn
An industrial Chinatown near the US southern border readies its options should Trump tariffs come ,2025-01-23T06:16:28.438525,cnn
How breakthroughs in AI are helping to design life-saving drugs faster than ever before ,2025-01-23T06:16:28.438525,cnn
Mattel’s Aaliyah tribute Barbie doll sells out on launch ,2025-01-23T06:16:28.438525,cnn
"NHTSA opens preliminary probe into more than 870,000 GM vehicles",2025-01-23T06:16:28.438525,cnn
