headline,date,source
Workers at a Whole Foods Market in Philadelphia become the 1st to unionize,2025-01-28T06:17:15.027560,ap
California considers letting victims of natural disasters sue oil companies for damages,2025-01-28T06:17:15.027560,ap
"At least 11 Baltic cables have been damaged in 15 months, prompting NATO to up its guard",2025-01-28T06:17:15.027560,ap
Italy sends 49 more migrants to Albania for processing following earlier court rejections,2025-01-28T06:17:15.027560,ap
"Chanel couture stuns with color, and Kylie Jenner, in final Paris show before Blazy’s debut",2025-01-28T06:17:15.027560,ap
Upstart Chinese AI company DeepSeek’s founder started out as a low-key hedge fund entrepreneur,2025-01-28T06:17:15.027560,ap
Trains canceled across Bangladesh as rail union goes on strike,2025-01-28T06:17:15.027560,ap
New Zealand reviews its aid to Kiribati after the Pacific island nation snubs an official’s visit,2025-01-28T06:17:15.027560,ap
DeepSeek’s new AI chatbot and ChatGPT answer sensitive questions about China differently,2025-01-28T06:17:15.027560,ap
"In the early going, Trump 2.0 approach on foreign policy is to talk loudly and carry a big stick",2025-01-28T06:17:15.027560,ap
Hundreds of US visa appointments canceled in Colombia following spat with Trump over deportations,2025-01-28T06:17:15.027560,ap
Explosion forces crew to abandon Hong Kong-flagged container ship in the Red Sea,2025-01-28T06:17:15.027560,ap
Russian government delegation makes first official visit to Syria since Assad’s fall,2025-01-28T06:17:15.027560,ap
ICC prosecutor seeking arrest warrants for those accused of atrocities in Sudan’s West Darfur region,2025-01-28T06:17:15.027560,ap
What has changed with immigration under Trump and what is still playing out?,2025-01-28T06:17:15.027560,ap
"Immigration officers are operating with a new sense of mission. Now, ‘nobody gets a free pass’",2025-01-28T06:17:15.027560,ap
Rain douses wildfires in Southern California without causing serious mudslides,2025-01-28T06:17:15.027560,ap
California utility reports fault on power line miles away from origin of deadly Eaton fire,2025-01-28T06:17:15.027560,ap
Norfolk Southern and East Palestine announce $22 million settlement after 2023 derailment,2025-01-28T06:17:15.027560,ap
"2 soldiers, 5 militants killed in southwest Pakistan during attack on security post",2025-01-28T06:17:15.027560,ap
"Trump’s tariff threat worked on Colombia, but his plans for Canada and Mexico carry higher stakes",2025-01-28T06:17:15.027560,ap
The Louvre needs full upgrade. President Macron is to address the Paris museum’s costly renovation.,2025-01-28T06:17:15.027560,ap
DeepSeek has rattled the AI industry. Here’s a quick look at other Chinese AI models,2025-01-28T06:17:15.027560,ap
Pakistani journalists protest after Senate passes bill allowing control over social media content,2025-01-28T06:17:15.027560,ap
Danish leader on European tour as Copenhagen moves to strengthen presence around Greenland,2025-01-28T06:17:15.027560,ap
Indonesia welcomes the Year of the Snake with dragon puppets and drum displays,2025-01-28T06:17:15.027560,ap
Stock market today: US markets stabilize after Monday’s tech swoon caused by Chinese AI startup,2025-01-28T06:17:15.027560,ap
"US places dozens of senior aid officials on leave, citing possible resistance to Trump orders",2025-01-28T06:17:15.027560,ap
Dozens take oath of US citizenship against Trump’s promise of mass deportations,2025-01-28T06:17:15.027560,ap
Full-scale replica of Anne Frank’s hidden annex opens in NYC,2025-01-28T06:17:15.027560,ap
Chinese tech startup DeepSeek says it was hit with ‘large-scale malicious attacks’,2025-01-28T06:17:15.027560,ap
"Their kinship sealed by fire, St. John the Divine brings Notre Dame to life in exhibition",2025-01-28T06:17:15.027560,ap
President Donald Trump has signed 10 executive orders on immigration and issued a slew of edicts to carry out promises of mass deportations and border security.,2025-01-28T06:17:15.027560,ap
Watch ICE make arrest in Maryland,2025-01-28T06:17:15.027560,ap
"A dozen immigration agents wearing body armor and armed with handguns gathered before dawn in a parking lot before fanning out to the Washington, D.C., suburbs to swoop up their targets. (AP Video: Mike Pesoli)",2025-01-28T06:17:15.027560,ap
"New Jersey officials remind immigrants to know their rights, not give into fear",2025-01-28T06:17:15.027560,ap
"Shooting at Indiana store leaves 3 dead, including the suspect, and 2 officers wounded",2025-01-28T06:17:15.027560,ap
"Tennessee opens session on school vouchers and Trump immigration push, as protests seek gun control",2025-01-28T06:17:15.027560,ap
Oklahoma proposal would require parents to provide proof of citizenship when enrolling students,2025-01-28T06:17:15.027560,ap
Trump orders a funding freeze as his administration reviews federal loans and grants,2025-01-28T06:17:15.027560,ap
Hawaii’s Kilauea volcano is spewing lava once again,2025-01-28T06:17:15.027560,ap
Google to change map names for Gulf of Mexico and Denali when US updates them based on Trump order,2025-01-28T06:17:15.027560,ap
Judge to seat jury in trial of ex-prosecutor accused of shielding Ahmaud Arbery’s killers,2025-01-28T06:17:15.027560,ap
How the Los Angeles wildfires will transform the 2025 Grammys,2025-01-28T06:17:15.027560,ap
New top prosecutor for DC advocated for Jan. 6 rioters and echoed Trump’s false 2020 election claims,2025-01-28T06:17:15.027560,ap
Kash Patel’s podcast persona: staunch Trump defender and fierce critic of the FBI he could soon lead,2025-01-28T06:17:15.027560,ap
What to know about Tuesday’s US House primaries to replace Matt Gaetz and Mike Waltz,2025-01-28T06:17:15.027560,ap
Blake Lively and Justin Baldoni get March 2026 trial date for her ‘It Ends With Us’ lawsuit,2025-01-28T06:17:15.027560,ap
Federal appeals judges try to untangle litigation over pending North Carolina court election,2025-01-28T06:17:15.027560,ap
Egg prices are soaring. Don’t expect that to change anytime soon,2025-01-28T06:17:15.027560,ap
Alaska House members urge Trump to keep the name of North America’s tallest peak as Denali,2025-01-28T06:17:15.027560,ap
Autopsy shows woman found atop Chicago-area medical center died of hypothermia from cold exposure,2025-01-28T06:17:15.027560,ap
"How China’s DeepSeek shook up US markets, by the numbers",2025-01-28T06:17:15.027560,ap
Trump pushes border crackdown at House Republican retreat as he caps first week in office,2025-01-28T06:17:15.027560,ap
Former Wisconsin chancellor fired over porn films sues in hopes of teaching again,2025-01-28T06:17:15.027560,ap
L.A. wildfire survivors struggling with FEMA applications could benefit from disaster case managers,2025-01-28T06:17:15.027560,ap
What are tariffs and how do they work?,2025-01-28T06:17:15.027560,ap
"Chiefs look to join the Shaq-Kobe Lakers, Yankees and Michael Jordan with a rare three-peat",2025-01-28T06:17:15.027560,ap
"President Donald Trump arrives to speak at the 2025 House Republican Members Conference Dinner at Trump National Doral Miami in Doral, Fla., Monday, Jan. 27, 2025. (AP Photo/Mark Schiefelbein)",2025-01-28T06:17:15.027560,ap
Trump signs an order to revise the Pentagon’s policy on transgender troops,2025-01-28T06:17:15.027560,ap
"President Donald Trump has signed a flurry of executive orders focused on the military. One directs Defense Secretary Pete Hegseth to revise the Pentagon’s policy on transgender troops, likely setting in motion a future ban on their military service.",2025-01-28T06:17:15.027560,ap
Trump fills his government with billionaires after running on a working-class message,2025-01-28T06:17:15.027560,ap
Trump Justice Department says it has fired employees involved in prosecutions of the president,2025-01-28T06:17:15.027560,ap
"After Trump’s tariff threats, Colombia agrees to accept deported migrants",2025-01-28T06:17:15.027560,ap
"The White House is claiming victory in a showdown with Colombia over accepting flights of deported migrants from the U.S., hours after President Donald Trump threatened steep tariffs on imports and other sanctions on the longtime U.S. partner.",2025-01-28T06:17:15.027560,ap
What is expected on Defense Secretary Hegseth’s first day at the Pentagon?,2025-01-28T06:17:15.027560,ap
"Karoline Leavitt, youngest White House press secretary, will make her debut in the briefing room",2025-01-28T06:17:15.027560,ap
Deb Haaland made history as Interior secretary. Now she’s running for governor of New Mexico,2025-01-28T06:17:15.027560,ap
"Scott Bessent confirmed as treasury secretary, giving him a key role in extending Trump’s tax cuts",2025-01-28T06:17:15.027560,ap
Supreme Court leaves in place Mississippi’s voting ban for people convicted of some crimes,2025-01-28T06:17:15.027560,ap
President Donald Trump has already forced Colombia to accept deportees by threatening tariffs and is readying the same move against Canada and Mexico as soon as Saturday.,2025-01-28T06:17:15.027560,ap
The Village of East Palestine and Norfolk Southern have announced a $22 million settlement resolving all of the village’s claims arising from a disastrous train derailment near the Ohio-Pennsylvania border in 2023.,2025-01-28T06:17:15.027560,ap
The White House is pausing federal grants and loans as President Donald Trump’s administration begins an across-the-board ideological review of its spending.,2025-01-28T06:17:15.027560,ap
Office plants add warmth to the workplace. Only some will thrive,2025-01-28T06:17:15.027560,ap
"Lush, green plants have the power to transform a space, imparting character, warmth and charm. And there are few places that could benefit more from that than your average office cubicle.",2025-01-28T06:17:15.027560,ap
Boeing posts $3.8 billion Q4 loss and has lost more than $35 billion since fatal crashes in 2019,2025-01-28T06:17:15.027560,ap
Boeing posted a fourth-quarter loss of $3.8 billion on Tuesday as a machinists strike and other problems continued to plague the troubled aircraft manufacturer.,2025-01-28T06:17:15.027560,ap
Coca-Cola issues safety recall of soft drinks in Europe over chemical chlorate concerns,2025-01-28T06:17:15.027560,ap
Coca-Cola has recalled some of its soft drinks in Europe after higher-than-normal levels of a chemical called chlorate were detected in bottles and cans at a Belgian production plant.,2025-01-28T06:17:15.027560,ap
"General Motors swung to a loss in the fourth quarter on huge charges related to China, but still topped profit and revenue expectations on Wall Street.",2025-01-28T06:17:15.027560,ap
United Nations officials say there were dead bodies on the streets of eastern Congo’s largest city where hospitals are overwhelmed and hundreds of thousands are fleeing gunfire and shelling.,2025-01-28T06:17:15.027560,ap
Trains have been canceled across Bangladesh as railway workers went on strike for higher pensions and other benefits.,2025-01-28T06:17:15.027560,ap
"President Donald Trump’s second White House is looking a lot like the inside of Mar-a-Lago, with extremely wealthy Americans taking key roles in his Republican administration.",2025-01-28T06:17:15.027560,ap
"Workers at a Whole Foods Market in Pennsylvania have voted to unionize, becoming the first group of employees to pull off a labor win at the Amazon-owned grocery store chain.",2025-01-28T06:17:15.027560,ap
New Zealand’s government is reviewing its aid to Kiribati after the Pacific island nation’s leader snubbed a planned meeting with New Zealand’s foreign minister.,2025-01-28T06:17:15.027560,ap
Texas Rangers create new network to oversee production and distribution of game broadcasts,2025-01-28T06:17:15.027560,ap
The Texas Rangers have created a new company to oversee production and distribution of their game broadcasts.,2025-01-28T06:17:15.027560,ap
It looks like grocery shoppers hoping for soaring egg prices to turn around are likely to be waiting a while.,2025-01-28T06:17:15.027560,ap
The U.S. Senate has confirmed billionaire investor Scott Bessent as President Donald Trump’s treasury secretary.,2025-01-28T06:17:15.027560,ap
California is considering a bill that would allow insurers and victims of climate-driven natural disasters to sue the oil industry for damages. State Sen.,2025-01-28T06:17:15.027560,ap
Chinese tech startup DeepSeek said it was hit by a cyber attack on Monday that disrupted users’ ability to register on the site.,2025-01-28T06:17:15.027560,ap
"How major US stock indexes fared Monday, 1/27/2025",2025-01-28T06:17:15.027560,ap
"Of the 118,000 FEMA applications made following the L.A. wildfires made by Jan. 27, less than 20% have received approval for Individual Assistance, according to the agency.",2025-01-28T06:17:15.027560,ap
Tariffs are in the news at the moment. But what are they? Tariffs are typically charged as a percentage of the price a buyer pays a foreign seller.,2025-01-28T06:17:15.027560,ap
What is DeepSeek? The AI bot is topping app charts,2025-01-28T06:17:15.027560,abc
Boeing has lost over $35B since 2019 fatal crashes,2025-01-28T06:17:15.027560,abc
"Trump's tariff threat worked on Colombia, but his plans for Canada and Mexico carry higher stakes",2025-01-28T06:17:15.027560,abc
White House budget office suspends aid programs,2025-01-28T06:17:15.027560,abc
Principal arrested over boozy house party for kids,2025-01-28T06:17:15.027560,abc
"3 dead, 2 cops injured in grocery store shooting",2025-01-28T06:17:15.027560,abc
Man killed in hammer throw accident at track meet,2025-01-28T06:17:15.027560,abc
Trump seeks immunity from state court civil suits,2025-01-28T06:17:15.027560,abc
"Leavitt, youngest WH press secretary, making debut",2025-01-28T06:17:15.027560,abc
South under severe weather and flash flood threat,2025-01-28T06:17:15.027560,abc
Major incidents reported amid Philly celebrations,2025-01-28T06:17:15.027560,abc
"Village, Norfolk Southern settle over derailment",2025-01-28T06:17:15.027560,abc
Florida educators speak out on curriculum changes,2025-01-28T06:17:15.027560,abc
Suspect with Molotov cocktail stopped at Capitol,2025-01-28T06:17:15.027560,abc
Doomsday Clock Moves One Second Closer to Catastrophe,2025-01-28T14:57:33.667993,nytimes
Senate Confirms Sean Duffy as Transportation Secretary,2025-01-28T14:57:33.667993,nytimes
White House Says F.A.A. Authorized N.J. Drones: ‘This Was Not the Enemy’,2025-01-28T14:57:33.667993,nytimes
Oklahoma Moves to Require Schools to Ask Students’ Immigration Status,2025-01-28T14:57:33.667993,nytimes
Nonprofits in New York Are Told Their Contracts ‘Have Been Paused’,2025-01-28T14:57:33.667993,nytimes
Democrats Block Bill to Impose Sanctions on International Criminal Court Officials,2025-01-28T14:57:33.667993,nytimes
"Hawaii Governor, a Doctor, Blames Kennedy for Measles Deaths in Samoa",2025-01-28T14:57:33.667993,nytimes
Nonprofits Fear Federal Grants Freeze Could Stop Critical Charity Work,2025-01-28T14:57:33.667993,nytimes
"Payment System That Provides Medicaid Funding to States Stops Working, Officials Say",2025-01-28T14:57:33.667993,nytimes
A Vatican Meeting Added to Scrutiny of Tulsi Gabbard’s Foreign Travels,2025-01-28T14:57:33.667993,nytimes
Inside Colombia’s Crisis Over Trump’s Deportations,2025-01-28T14:57:33.667993,nytimes
Wednesday Briefing: Trump’s Funding Freeze,2025-01-28T14:57:33.667993,nytimes
Hacking Democracy: How Elon Musk Is Disrupting European Politics,2025-01-28T14:57:33.667993,nytimes
"Mauricio Funes, Salvadoran President Who Fled to Nicaragua, Dies at 65",2025-01-28T14:57:33.667993,nytimes
Hundreds of Protesters Attack Foreign Embassies in Congo,2025-01-28T14:57:33.667993,nytimes
Macron Announces New Exhibition Space For Mona Lisa at the Louvre,2025-01-28T14:57:33.667993,nytimes
"France, Finally, Wins the World’s Top Food Award Again",2025-01-28T14:57:33.667993,nytimes
"Woman in Disguise Took U.K. Citizenship Test for Others, Authorities Say",2025-01-28T14:57:33.667993,nytimes
Vatican Warns About the Risks of Artificial Intelligence,2025-01-28T14:57:33.667993,nytimes
"What Is M23, the Rwandan-Backed Group Fighting in Eastern Congo?",2025-01-28T14:57:33.667993,nytimes
Tech Stocks Stabilize on Day After Rout,2025-01-28T14:57:33.667993,nytimes
Trump Fired E.E.O.C. Commissioners in Late-Night Purge,2025-01-28T14:57:33.667993,nytimes
"Jay Mazur, Zealous Advocate for Garment Workers, Dies at 92",2025-01-28T14:57:33.667993,nytimes
"Welcome, Podcasters! White House Wants New Media at the Press Briefing",2025-01-28T14:57:33.667993,nytimes
Do China’s A.I. Advances Mean U.S. Technology Controls Have Failed?,2025-01-28T14:57:33.667993,nytimes
Marshall Project Names Katrice Hardy as Chief Executive,2025-01-28T14:57:33.667993,nytimes
The Federal Funding Pause Does Not Apply to Student Loans and Pell Grants,2025-01-28T14:57:33.667993,nytimes
"Zuckerberg Joins the Business Roundtable, a Signal of His Political Ambitions",2025-01-28T14:57:33.667993,nytimes
"Inside China, DeepSeek Provides a National Mic Drop Moment",2025-01-28T14:57:33.667993,nytimes
The $8 Billion Children’s Vaccine Fund Kennedy Would Oversee,2025-01-28T14:57:33.667993,nytimes
Mass Shootings in the US Fast Facts ,2025-01-28T14:57:33.667993,cnn
"Marijuana and your memory, Doomsday Clock is ticking, flavor of the year: Catch up on the day’s stories",2025-01-28T14:57:33.667993,cnn
Oklahoma Board of Education votes to approve proposal requiring parents to prove citizenship when enrolling students,2025-01-28T14:57:33.667993,cnn
Visualizing how mass shootings in 2025 compare with past years,2025-01-28T14:57:33.667993,cnn
Spectator is killed by a stray hammer thrown at a Colorado youth track and field meet ,2025-01-28T14:57:33.667993,cnn
Employee struck and killed by vehicle in accident at Charlotte Douglas International Airport,2025-01-28T14:57:33.667993,cnn
Navajo Nation leaders raise alarm over reports of Indigenous people being questioned and detained during immigration sweeps ,2025-01-28T14:57:33.667993,cnn
Visitors flock to New York botanic garden for a whiff of a flower that smells like a rotting corpse ,2025-01-28T14:57:33.667993,cnn
Watch frozen iguana fall from tree and get bitten by cat ,2025-01-28T14:57:33.667993,cnn
Legal expert on why Trump’s federal grants freeze is ‘definitely headed for the courts’ ,2025-01-28T14:57:33.667993,cnn
Caroline Kennedy calls cousin RFK Jr. a ‘predator’ ahead of his confirmation hearings to be Trump’s health secretary,2025-01-28T14:57:33.667993,cnn
Trump administration to offer buyouts to federal workers,2025-01-28T14:57:33.667993,cnn
Judge temporarily blocks part of Trump administration’s plans to freeze federal aid,2025-01-28T14:57:33.667993,cnn
What the White House meant when it said Biden directed the mass killing of 100 million chickens ,2025-01-28T14:57:33.667993,cnn
"Coffee prices are rising, despite Trump’s canceled tariff on Colombia",2025-01-28T14:57:33.667993,cnn
Trump’s raids are made for TV,2025-01-28T14:57:33.667993,cnn
Trump just gave his clearest picture yet of what new tariffs could look like,2025-01-28T14:57:33.667993,cnn
In pictures: The greatest Super Bowl records ,2025-01-28T14:57:33.667993,cnn
All the Super Bowl rings ,2025-01-28T14:57:33.667993,cnn
"A teen girl died in a Colorado house fire. As investigators dug into the case, the mystery deepened ",2025-01-28T14:57:33.667993,cnn
"Child arrested after reposting a violent message, thinking he was warning others ",2025-01-28T14:57:33.667993,cnn
"PD: Subway train stolen, taken for joyride",2025-01-28T14:57:33.667993,cnn
Photo lost in CA wildfires returned to owner,2025-01-28T14:57:33.667993,cnn
PD: 88-year-old charged with his wife’s murder,2025-01-28T14:57:33.667993,cnn
Honeybees equipped with tiny QR codes,2025-01-28T14:57:33.667993,cnn
Community comes to the aid of local doctor,2025-01-28T14:57:33.667993,cnn
Tuskegee Airman positive legacy won’t be erased,2025-01-28T14:57:33.667993,cnn
Family transforms backyard into ice rink,2025-01-28T14:57:33.667993,cnn
Professional jump roper saves drowning teen using double-dutch ropes ,2025-01-28T14:57:33.667993,cnn
"Girl, 12, dies after accidentally shooting herself",2025-01-28T14:57:33.667993,cnn
Ice highway across lake saves drivers hours,2025-01-28T14:57:33.667993,cnn
City attorney sues mayor for withholding pay,2025-01-28T14:57:33.667993,cnn
Outdoor cat shelter set on fire,2025-01-28T14:57:33.667993,cnn
Mother finds strange man in her attic,2025-01-28T14:57:33.667993,cnn
Suspected intruder found on roof of school,2025-01-28T14:57:33.667993,cnn
Property up for sale without owners’ knowledge,2025-01-28T14:57:33.667993,cnn
WATCH: Man reunited with missing dog after 8 years apart ,2025-01-28T14:57:33.667993,cnn
Employees wrestle with ‘robot server kidnapper’,2025-01-28T14:57:33.667993,cnn
Justin Timberlake helps with gender reveal,2025-01-28T14:57:33.667993,cnn
Woman seriously injured after setting off firework,2025-01-28T14:57:33.667993,cnn
Coach suspended after reports of antisemitism,2025-01-28T14:57:33.667993,cnn
Students design patrol car for resource officer,2025-01-28T14:57:33.667993,cnn
Parking scam spreads through text messages,2025-01-28T14:57:33.667993,cnn
Compassionate release law frees child molester,2025-01-28T14:57:33.667993,cnn
"Elon Musk’s support of right-wing parties ‘is really disgusting,’ German Chancellor tells CNN ",2025-01-28T14:57:33.667993,cnn
‘I am finally at home’: Freed Israeli hostage Naama Levy shares message,2025-01-28T14:57:33.667993,cnn
Violence erupts in mineral-rich DR Congo as rebels move into key city. Here’s what we know,2025-01-28T14:57:33.667993,cnn
Italian prime minister says she is being investigated for repatriating a Libyan warlord,2025-01-28T14:57:33.667993,cnn
"‘When he wants something, it happens.’ Israel’s far right applauds Trump’s Gaza plan",2025-01-28T14:57:33.667993,cnn
"Arrested under Biden, deported under Trump: Guatemalans sent back and welcomed with cookies",2025-01-28T14:57:33.667993,cnn
How your phone may be fueling deadly fighting in Congo ,2025-01-28T14:57:33.667993,cnn
‘We are happy but sad:’ Hear from Palestinians returning to northern Gaza ,2025-01-28T14:57:33.667993,cnn
Melissa Bell sits down with holocaust survivors for 80th anniversary of Auschwitz liberation ,2025-01-28T14:57:33.667993,cnn
Suicidal tendencies and ’80s battlefield tactics: How North Korean soldiers are operating in Russia’s war on Ukraine ,2025-01-28T14:57:33.667993,cnn
Denmark boosts Arctic defense spending by $2 billion after Trump’s Greenland interest,2025-01-28T14:57:33.667993,cnn
"Israel’s war inflicted ‘life-threatening danger’ on pregnant women and girls in Gaza, Human Rights Watch says ",2025-01-28T14:57:33.667993,cnn
Israel says eight of the remaining hostages to be released by Hamas in phase one of deal are dead,2025-01-28T14:57:33.667993,cnn
Latin American leaders are learning how to handle Trump. Colombia’s president showed how not to do it ,2025-01-28T14:57:33.667993,cnn
Afghanistan food crisis deepens as aid cuts leave many living on ‘just bread and tea’ ,2025-01-28T14:57:33.667993,cnn
Boom: America’s answer to Concorde completes its first supersonic flight ,2025-01-28T14:57:33.667993,cnn
Chinese zodiac predictions: What’s in store for 2025 as we enter the Year of the Snake,2025-01-28T14:57:33.667993,cnn
‘Things are really changing for them’: Why explorer known as ‘Indiana Jones for girls’ is walking across Saudi Arabia,2025-01-28T14:57:33.667993,cnn
Fashion mixes with politics at Paris Men’s Fashion Week ,2025-01-28T14:57:33.667993,cnn
Look of the Week: First lady Melania Trump means business in official portrait,2025-01-28T14:57:33.667993,cnn
Deepika Padukone and Christy Turlington star in landmark Sabyasachi fashion show,2025-01-28T14:57:33.667993,cnn
China celebrates DeepSeek’s breakout AI success as tech race heats up ,2025-01-28T14:57:33.667993,cnn
What the White House meant when it said Biden directed the mass killing of 100 million chickens,2025-01-28T14:57:33.667993,cnn
"Coffee prices are rising, despite Trump’s canceled tariff on Colombia ",2025-01-28T14:57:33.667993,cnn
Trump’s raids are made for TV ,2025-01-28T14:57:33.667993,cnn
Trump just gave his clearest picture yet of what new tariffs could look like ,2025-01-28T14:57:33.667993,cnn
DeepSeek just blew up the AI industry’s narrative that it needs more money and power,2025-01-28T14:57:33.667993,cnn
Workers at Philadelphia Whole Foods vote to form first union for Amazon-owned supermarket chain,2025-01-28T14:57:33.667993,cnn
"Using Trump’s own legal arguments, Pulitzer Board seeks stay of Trump defamation case while he’s in office",2025-01-28T14:57:33.667993,cnn
Jim Acosta announces he is leaving CNN ,2025-01-28T14:57:33.667993,cnn
Trump DOJ appointee in DC lashes out after flurry of ‘personally insulting’ leaks in his first week,2025-01-28T14:57:33.667993,cnn
Senate Democrats block International Criminal Court sanctions bill in response to Netanyahu warrant,2025-01-28T14:57:33.667993,cnn
"Trump’s ban on trans service members is challenged in court, reigniting a fight that wasn’t settled during his first term",2025-01-28T14:57:33.667993,cnn
White House says New Jersey drones that caused hysteria were ‘not the enemy’,2025-01-28T14:57:33.667993,cnn
‘There is confusion’: Jake Tapper pushes Stephen Miller to explain order to freeze federal aid ,2025-01-28T14:57:33.667993,cnn
Brianna Keilar presses superintendent on rule that would require schools to track families’ immigration status ,2025-01-28T14:57:33.667993,cnn
"Democratic Sen. Gary Peters not running for reelection, opening up battleground Michigan seat in 2026",2025-01-28T14:57:33.667993,cnn
Intel officials spent years battling Kash Patel. Now he’s poised to take over a key agency,2025-01-28T14:57:33.667993,cnn
